{
  "$schema": "../../schema.json",
  "description": "æ—¢å­˜ã®standardè¨­å®šã«é«˜åº¦ãªã‚ªãƒ—ã‚·ãƒ§ãƒ³ã‚’çµ„ã¿åˆã‚ã›ãŸä¾‹",
  "allowedTools": [
    "view",
    "grep",
    "glob",
    "edit",
    "create",
    "bash",
    "list_bash",
    "web_fetch",
    "web_search",
    "report_progress",
    "code_review",
    "codeql_checker",
    "gh-advisory-database",
    "task",
    "github-mcp-server-get_file_contents",
    "github-mcp-server-list_commits",
    "github-mcp-server-list_pull_requests",
    "github-mcp-server-list_issues",
    "github-mcp-server-search_code",
    "github-mcp-server-search_repositories",
    "github-mcp-server-pull_request_read",
    "github-mcp-server-issue_read"
  ],
  "disallowedTools": [
    "write_bash",
    "read_bash",
    "stop_bash",
    "playwright-browser_navigate",
    "playwright-browser_click",
    "playwright-browser_type",
    "playwright-browser_fill_form",
    "playwright-browser_evaluate",
    "playwright-browser_drag",
    "playwright-browser_file_upload",
    "github-mcp-server-actions_get",
    "github-mcp-server-actions_list"
  ],
  "toolRestrictions": {
    "bash": {
      "allowedCommands": [
        "git status",
        "git diff",
        "git log",
        "git branch",
        "npm install",
        "npm test",
        "npm run",
        "yarn install",
        "yarn test",
        "pip install",
        "pytest",
        "mvn test",
        "gradle test",
        "make",
        "cargo build",
        "cargo test",
        "go test",
        "go build"
      ],
      "disallowedCommands": [
        "rm -rf",
        "sudo",
        "chmod 777",
        "git push --force",
        "git reset --hard",
        "dd",
        "mkfs",
        "format"
      ]
    },
    "edit": {
      "maxFileSize": 1000000
    },
    "create": {
      "maxFileSize": 1000000,
      "disallowedPaths": [
        "/.git/",
        "/etc/",
        "/usr/",
        "/bin/"
      ]
    }
  },
  "permissions": {
    "allow": [
      "Read(./src/**)",
      "Read(./tests/**)",
      "Read(./docs/**)",
      "Write(./src/**)",
      "Write(./tests/**)",
      "Bash(npm *)",
      "Bash(yarn *)",
      "Bash(git status)",
      "Bash(git diff)",
      "Bash(git log *)"
    ],
    "deny": [
      "Read(**/.env*)",
      "Read(**/secrets/**)",
      "Read(**/*.key)",
      "Write(**/node_modules/**)",
      "Bash(rm -rf *)",
      "Bash(sudo *)"
    ],
    "ask": [
      "Write(./package.json)",
      "Write(./package-lock.json)"
    ],
    "defaultMode": "ask"
  },
  "env": {
    "NODE_ENV": "development",
    "DEBUG": "app:*"
  },
  "llm": {
    "model": "claude-sonnet-4-20250514",
    "temperature": 0.3
  },
  "hooks": {
    "SessionStart": [
      {
        "type": "command",
        "command": "echo 'ğŸ“Š ãƒ—ãƒ­ã‚¸ã‚§ã‚¯ãƒˆçŠ¶æ…‹' && git status --short",
        "matcher": "startup"
      }
    ]
  },
  "notes": [
    "ã“ã®è¨­å®šã¯ configs/standard/settings.json ã‚’ãƒ™ãƒ¼ã‚¹ã«ã—ã¦ã„ã¾ã™",
    "æ–°ã—ã„é«˜åº¦ãªã‚ªãƒ—ã‚·ãƒ§ãƒ³ã‚’è¿½åŠ ã§çµ„ã¿è¾¼ã‚“ã§ã„ã¾ã™ï¼š",
    "  - permissions: ã‚ˆã‚Šç´°ã‹ã„æ¨©é™åˆ¶å¾¡",
    "  - env: ç’°å¢ƒå¤‰æ•°ã®è¨­å®š",
    "  - llm: ãƒ¢ãƒ‡ãƒ«è¨­å®š",
    "  - hooks: ã‚»ãƒƒã‚·ãƒ§ãƒ³é–‹å§‹æ™‚ã®git statusè‡ªå‹•è¡¨ç¤º",
    "æ—¢å­˜ã® allowedTools ã¨ toolRestrictions ã¯ãã®ã¾ã¾ç¶­æŒ",
    "æ–°æ—§ã®ã‚ªãƒ—ã‚·ãƒ§ãƒ³ã¯å®Œå…¨ã«äº’æ›æ€§ãŒã‚ã‚Šã¾ã™"
  ]
}
