{
  "$schema": "../../schema.json",
  "description": "æœ€é©åŒ–æ¸ˆã¿ï¼šåŸºæœ¬è¨­å®šï¼ˆèª­ã¿å–ã‚Šå°‚ç”¨ï¼‰ - ã‚»ã‚­ãƒ¥ãƒªãƒ†ã‚£é‡è¦–ã®æœ€å°æ¨©é™è¨­å®š",
  "allowedTools": [
    "view",
    "grep",
    "glob",
    "list_bash"
  ],
  "disallowedTools": [
    "bash",
    "edit",
    "create",
    "playwright-browser_navigate",
    "playwright-browser_click",
    "playwright-browser_type",
    "playwright-browser_fill_form",
    "playwright-browser_evaluate",
    "web_fetch",
    "web_search",
    "write_bash",
    "read_bash",
    "stop_bash",
    "report_progress",
    "code_review",
    "codeql_checker",
    "gh-advisory-database",
    "task"
  ],
  "toolRestrictions": {
    "view": {
      "maxFileSize": 100000,
      "allowedDirectories": [
        "/home/runner/work"
      ]
    },
    "grep": {
      "maxResults": 100
    }
  },
  "permissions": {
    "allow": [
      "Read(./src/**)",
      "Read(./tests/**)",
      "Read(./docs/**)",
      "Read(./README.md)"
    ],
    "deny": [
      "Read(**/.env*)",
      "Read(**/secrets/**)",
      "Read(**/.aws/**)",
      "Read(**/.ssh/**)",
      "Read(**/*.key)",
      "Read(**/*.pem)",
      "Write(**/*)",
      "Bash(**)"
    ],
    "defaultMode": "reject"
  },
  "llm": {
    "model": "claude-3-5-haiku-20250120",
    "temperature": 0.5
  },
  "limits": {
    "maxFileSize": 100000,
    "maxResults": 100,
    "maxMemory": 512
  },
  "notes": [
    "ğŸ¯ ã“ã®è¨­å®šã¯æœ€é©åŒ–æ¸ˆã¿ã§ã€ãã®ã¾ã¾ä½¿ç”¨ã§ãã¾ã™",
    "ã‚»ã‚­ãƒ¥ãƒªãƒ†ã‚£æœ€å„ªå…ˆã®èª­ã¿å–ã‚Šå°‚ç”¨è¨­å®šï¼š",
    "  âœ“ permissions: èª­ã¿å–ã‚Šå°‚ç”¨ã«åˆ¶é™",
    "  âœ“ llm: é«˜é€ŸãªHaikuãƒ¢ãƒ‡ãƒ«ï¼ˆã‚³ã‚¹ãƒˆå‰Šæ¸›ï¼‰",
    "  âœ“ limits: å³æ ¼ãªãƒªã‚½ãƒ¼ã‚¹åˆ¶é™",
    "ã‚³ãƒ¼ãƒ‰ãƒ¬ãƒ“ãƒ¥ãƒ¼ã‚„æ¢ç´¢ã®ã¿ã«é©ã—ã¦ã„ã¾ã™",
    "ãƒ•ã‚¡ã‚¤ãƒ«å¤‰æ›´ã‚„ã‚³ãƒãƒ³ãƒ‰å®Ÿè¡Œã¯ä¸€åˆ‡ã§ãã¾ã›ã‚“"
  ]
}
