{
  "description": "MCP GitHub Integration - Permissions for GitHub operations via Model Context Protocol",
  "allowedTools": [
    "github-mcp-server-get_file_contents",
    "github-mcp-server-list_commits",
    "github-mcp-server-get_commit",
    "github-mcp-server-list_branches",
    "github-mcp-server-list_tags",
    "github-mcp-server-get_tag",
    "github-mcp-server-list_pull_requests",
    "github-mcp-server-pull_request_read",
    "github-mcp-server-list_issues",
    "github-mcp-server-issue_read",
    "github-mcp-server-search_code",
    "github-mcp-server-search_repositories",
    "github-mcp-server-search_pull_requests",
    "github-mcp-server-search_issues",
    "github-mcp-server-search_users",
    "github-mcp-server-list_releases",
    "github-mcp-server-get_latest_release",
    "github-mcp-server-get_release_by_tag"
  ],
  "disallowedTools": [
    "github-mcp-server-actions_list",
    "github-mcp-server-actions_get",
    "github-mcp-server-get_job_logs",
    "github-mcp-server-list_code_scanning_alerts",
    "github-mcp-server-get_code_scanning_alert",
    "github-mcp-server-list_secret_scanning_alerts",
    "github-mcp-server-get_secret_scanning_alert"
  ],
  "toolRestrictions": {
    "rateLimit": {
      "maxRequestsPerMinute": 60,
      "maxRequestsPerHour": 5000
    },
    "search": {
      "maxResults": 100
    }
  },
  "notes": [
    "Allows read-only GitHub operations via MCP",
    "Suitable for code exploration and repository analysis",
    "Actions and security scanning are disabled for safety",
    "Rate limits align with GitHub API defaults",
    "Requires GitHub token with read permissions"
  ]
}
