{
  "description": "MCP Security Scanning Integration - Permissions for security analysis operations",
  "allowedTools": [
    "github-mcp-server-list_code_scanning_alerts",
    "github-mcp-server-get_code_scanning_alert",
    "github-mcp-server-list_secret_scanning_alerts",
    "github-mcp-server-get_secret_scanning_alert"
  ],
  "disallowedTools": [],
  "toolRestrictions": {
    "rateLimit": {
      "maxRequestsPerMinute": 30,
      "maxRequestsPerHour": 1000
    },
    "alerts": {
      "maxAlertsPerRequest": 100,
      "severityFilter": ["critical", "high", "medium", "low"]
    }
  },
  "notes": [
    "Allows access to GitHub security scanning features",
    "Suitable for security analysis and vulnerability management",
    "Requires GitHub token with security_events:read permission",
    "Should be combined with codeql_checker tool for comprehensive security",
    "Use in conjunction with gh-advisory-database for dependency scanning"
  ]
}
