{
  "$schema": "../../schema.json",
  "description": "ãƒ•ãƒƒã‚¯æ©Ÿèƒ½ã‚’æ´»ç”¨ã—ãŸè‡ªå‹•åŒ–è¨­å®š",
  "allowedTools": [
    "view",
    "grep",
    "glob",
    "edit",
    "create",
    "bash",
    "report_progress",
    "code_review"
  ],
  "toolRestrictions": {
    "bash": {
      "allowedCommands": [
        "npm run *",
        "npm test",
        "git *"
      ]
    }
  },
  "hooks": {
    "SessionStart": [
      {
        "type": "command",
        "command": "echo 'â”â”â”â”â”â”â”â”â”â”â”â”â”â”â”â”â”â”â”â”â”â”â”â”â”â”â”â”â”â”â”â”â”â”â”â”â”â”â”â”' && echo 'ğŸ“Š ãƒ—ãƒ­ã‚¸ã‚§ã‚¯ãƒˆçŠ¶æ…‹' && echo 'â”â”â”â”â”â”â”â”â”â”â”â”â”â”â”â”â”â”â”â”â”â”â”â”â”â”â”â”â”â”â”â”â”â”â”â”â”â”â”â”'",
        "matcher": "startup"
      },
      {
        "type": "command",
        "command": "echo '' && echo 'ğŸŒ¿ Git ãƒ–ãƒ©ãƒ³ãƒ:' && git branch --show-current",
        "matcher": "startup"
      },
      {
        "type": "command",
        "command": "echo '' && echo 'ğŸ“ å¤‰æ›´ãƒ•ã‚¡ã‚¤ãƒ«:' && git status --short",
        "matcher": "startup"
      },
      {
        "type": "command",
        "command": "echo '' && echo 'ğŸ“š æœ€è¿‘ã®ã‚³ãƒŸãƒƒãƒˆ:' && git log --oneline --graph -5",
        "matcher": "startup"
      },
      {
        "type": "command",
        "command": "echo '' && echo 'ğŸ” ä¾å­˜é–¢ä¿‚ã®çŠ¶æ…‹:' && npm outdated || echo 'âœ… ã™ã¹ã¦ã®ä¾å­˜é–¢ä¿‚ãŒæœ€æ–°ã§ã™'",
        "matcher": "startup"
      },
      {
        "type": "command",
        "command": "echo '' && echo 'â”â”â”â”â”â”â”â”â”â”â”â”â”â”â”â”â”â”â”â”â”â”â”â”â”â”â”â”â”â”â”â”â”â”â”â”â”â”â”â”'"
      }
    ],
    "BeforeEdit": [
      {
        "type": "command",
        "command": "echo 'ğŸ” ç·¨é›†å‰ãƒã‚§ãƒƒã‚¯: Lintå®Ÿè¡Œä¸­...' && npm run lint:check"
      }
    ],
    "AfterEdit": [
      {
        "type": "command",
        "command": "echo 'âœ… ç·¨é›†å®Œäº†: ãƒ•ã‚©ãƒ¼ãƒãƒƒãƒˆç¢ºèªä¸­...' && npm run format:check"
      }
    ]
  },
  "env": {
    "NODE_ENV": "development",
    "DEBUG": "app:*"
  },
  "llm": {
    "model": "claude-sonnet-4-20250514"
  },
  "notes": [
    "hooksæ©Ÿèƒ½ã‚’ä½¿ã£ãŸè‡ªå‹•åŒ–ã®ä¾‹",
    "SessionStartã§ã€ãƒ—ãƒ­ã‚¸ã‚§ã‚¯ãƒˆã®çŠ¶æ…‹ã‚’è‡ªå‹•è¡¨ç¤º",
    "BeforeEdit/AfterEditã§ã€Lint/ãƒ•ã‚©ãƒ¼ãƒãƒƒãƒˆãƒã‚§ãƒƒã‚¯ã‚’è‡ªå‹•å®Ÿè¡Œ",
    "matcherã‚ªãƒ—ã‚·ãƒ§ãƒ³ã§ã€èµ·å‹•æ™‚ã®ã¿å®Ÿè¡Œã™ã‚‹ãƒ•ãƒƒã‚¯ã‚’åˆ¶å¾¡å¯èƒ½"
  ]
}
