{
  "$schema": "../../schema.json",
  "description": "æœ€é©åŒ–æ¸ˆã¿ï¼šä¸Šç´šè¨­å®šï¼ˆå…¨æ©Ÿèƒ½ï¼‰ - å®Œå…¨ä¿¡é ¼ç’°å¢ƒå‘ã‘ãƒ•ãƒ«æ©Ÿèƒ½è¨­å®š",
  "allowedTools": [
    "view",
    "grep",
    "glob",
    "edit",
    "create",
    "bash",
    "list_bash",
    "write_bash",
    "read_bash",
    "stop_bash",
    "web_fetch",
    "web_search",
    "report_progress",
    "code_review",
    "codeql_checker",
    "gh-advisory-database",
    "task",
    "github-mcp-server-get_file_contents",
    "github-mcp-server-list_commits",
    "github-mcp-server-list_pull_requests",
    "github-mcp-server-list_issues",
    "github-mcp-server-search_code",
    "github-mcp-server-search_repositories",
    "github-mcp-server-pull_request_read",
    "github-mcp-server-issue_read",
    "github-mcp-server-actions_get",
    "github-mcp-server-actions_list",
    "github-mcp-server-get_job_logs",
    "playwright-browser_navigate",
    "playwright-browser_click",
    "playwright-browser_snapshot",
    "playwright-browser_take_screenshot"
  ],
  "disallowedTools": [],
  "toolRestrictions": {
    "bash": {
      "disallowedCommands": [
        "rm -rf /",
        "mkfs",
        "dd if=/dev/zero",
        ":(){ :|:& };:"
      ],
      "executionTimeout": 600000
    },
    "edit": {
      "maxFileSize": 10000000
    },
    "create": {
      "maxFileSize": 10000000
    }
  },
  "permissions": {
    "allow": [
      "Read(**/*)",
      "Write(**/*)",
      "Bash(**)"
    ],
    "deny": [
      "Bash(rm -rf /)",
      "Bash(mkfs *)",
      "Bash(dd if=/dev/zero *)",
      "Bash(format *)"
    ],
    "defaultMode": "acceptEdits"
  },
  "env": {
    "NODE_ENV": "development",
    "DEBUG": "*"
  },
  "llm": {
    "model": "claude-sonnet-4-20250514",
    "temperature": 0.3,
    "maxTokens": 8192
  },
  "execution": {
    "timeout": 600,
    "maxConcurrent": 10
  },
  "limits": {
    "maxFileSize": 10000000,
    "maxResults": 500,
    "maxMemory": 4096
  },
  "hooks": {
    "SessionStart": [
      {
        "type": "command",
        "command": "echo 'ğŸš€ ãƒ•ãƒ«æ©Ÿèƒ½ãƒ¢ãƒ¼ãƒ‰èµ·å‹•' && echo 'ğŸ“Š GitçŠ¶æ…‹' && git status --short && echo 'ğŸŒ¿ ãƒ–ãƒ©ãƒ³ãƒ:' && git branch --show-current",
        "matcher": "startup"
      }
    ]
  },
  "agents": [
    {
      "name": "explorer",
      "path": "./agents/explorer.json",
      "model": "claude-3-5-haiku-20250120",
      "permissions": {
        "allow": [
          "Read(**/*)",
          "Bash(grep *)",
          "Bash(find *)"
        ]
      }
    },
    {
      "name": "builder",
      "path": "./agents/builder.json",
      "model": "claude-3-5-haiku-20250120",
      "permissions": {
        "allow": [
          "Bash(npm *)",
          "Bash(cargo *)",
          "Bash(make *)"
        ]
      }
    }
  ],
  "plugins": [
    "prettier",
    "eslint",
    "typescript"
  ],
  "theme": "dark",
  "verbose": true,
  "notes": [
    "ğŸ¯ ã“ã®è¨­å®šã¯æœ€é©åŒ–æ¸ˆã¿ã§ã€ãã®ã¾ã¾ä½¿ç”¨ã§ãã¾ã™",
    "å®Œå…¨ä¿¡é ¼ç’°å¢ƒå‘ã‘ã®ãƒ•ãƒ«æ©Ÿèƒ½è¨­å®šï¼š",
    "  âœ“ permissions: ã»ã¼å…¨ã¦ã®æ“ä½œã‚’è¨±å¯ï¼ˆç ´å£Šçš„ã‚³ãƒãƒ³ãƒ‰ã®ã¿æ‹’å¦ï¼‰",
    "  âœ“ agents: æ¢ç´¢ç”¨ãƒ»ãƒ“ãƒ«ãƒ‰ç”¨ã‚¨ãƒ¼ã‚¸ã‚§ãƒ³ãƒˆè¨­å®šæ¸ˆã¿",
    "  âœ“ llm: æœ€æ–°Sonnetãƒ¢ãƒ‡ãƒ«ã€å¤§å®¹é‡ãƒˆãƒ¼ã‚¯ãƒ³",
    "  âœ“ hooks: è©³ç´°ãªã‚»ãƒƒã‚·ãƒ§ãƒ³é–‹å§‹æƒ…å ±",
    "  âœ“ execution/limits: é«˜ã„åˆ¶é™å€¤",
    "  âœ“ plugins: ä¸»è¦ãªé–‹ç™ºãƒ„ãƒ¼ãƒ«çµ±åˆ",
    "çµŒé¨“è±Šå¯Œãªé–‹ç™ºè€…ã€å®Œå…¨ã«ä¿¡é ¼ã§ãã‚‹ç’°å¢ƒã§ã®ã¿ä½¿ç”¨ã—ã¦ãã ã•ã„"
  ]
}
