{
  "$schema": "../../schema.json",
  "description": "モデル設定とエージェント機能を活用した設定",
  "allowedTools": [
    "view",
    "grep",
    "glob",
    "edit",
    "create",
    "bash",
    "task",
    "report_progress"
  ],
  "toolRestrictions": {
    "bash": {
      "allowedCommands": [
        "npm *",
        "git *",
        "python *",
        "cargo *"
      ]
    }
  },
  "llm": {
    "model": "claude-sonnet-4-20250514",
    "temperature": 0.3,
    "maxTokens": 8192
  },
  "agents": [
    {
      "name": "fast-explorer",
      "path": "./agents/fast-explorer.json",
      "model": "claude-3-5-haiku-20250120",
      "permissions": {
        "allow": [
          "Read(**/*)",
          "Bash(grep *)",
          "Bash(find *)",
          "Bash(git log *)"
        ],
        "deny": [
          "Write(**/*)",
          "Bash(rm *)"
        ]
      }
    },
    {
      "name": "test-runner",
      "path": "./agents/test-runner.json",
      "model": "claude-3-5-haiku-20250120",
      "permissions": {
        "allow": [
          "Bash(npm test)",
          "Bash(npm run test:*)",
          "Bash(pytest *)",
          "Bash(cargo test)",
          "Read(./tests/**)",
          "Read(./src/**)"
        ],
        "deny": [
          "Write(**/*)"
        ]
      }
    },
    {
      "name": "code-writer",
      "path": "./agents/code-writer.json",
      "model": "claude-sonnet-4-20250514",
      "permissions": {
        "allow": [
          "Read(./src/**)",
          "Write(./src/**)",
          "Bash(git status)",
          "Bash(npm run lint)"
        ]
      }
    }
  ],
  "execution": {
    "timeout": 600,
    "maxConcurrent": 3
  },
  "env": {
    "NODE_ENV": "development"
  },
  "notes": [
    "異なるモデルを使い分けた効率的な開発設定",
    "fast-explorer: Haikuモデルで高速なコード探索",
    "test-runner: Haikuモデルで高速なテスト実行",
    "code-writer: Sonnetモデルで高品質なコード生成",
    "各エージェントに適切な権限を個別設定"
  ]
}
