{
  "$schema": "../../schema.json",
  "description": "æœ€é©åŒ–æ¸ˆã¿ï¼šæ¨™æº–é–‹ç™ºç’°å¢ƒè¨­å®šï¼ˆæ¨å¥¨ï¼‰ - æ—¢å­˜ã®standardè¨­å®šã«å®Ÿç”¨çš„ãªé«˜åº¦ã‚ªãƒ—ã‚·ãƒ§ãƒ³ã‚’çµ„ã¿è¾¼ã¿æ¸ˆã¿",
  "allowedTools": [
    "view",
    "grep",
    "glob",
    "edit",
    "create",
    "bash",
    "list_bash",
    "web_fetch",
    "web_search",
    "report_progress",
    "code_review",
    "codeql_checker",
    "gh-advisory-database",
    "task",
    "github-mcp-server-get_file_contents",
    "github-mcp-server-list_commits",
    "github-mcp-server-list_pull_requests",
    "github-mcp-server-list_issues",
    "github-mcp-server-search_code",
    "github-mcp-server-search_repositories",
    "github-mcp-server-pull_request_read",
    "github-mcp-server-issue_read"
  ],
  "disallowedTools": [
    "write_bash",
    "read_bash",
    "stop_bash",
    "playwright-browser_navigate",
    "playwright-browser_click",
    "playwright-browser_type",
    "playwright-browser_fill_form",
    "playwright-browser_evaluate",
    "playwright-browser_drag",
    "playwright-browser_file_upload",
    "github-mcp-server-actions_get",
    "github-mcp-server-actions_list"
  ],
  "toolRestrictions": {
    "bash": {
      "allowedCommands": [
        "git status",
        "git diff",
        "git log",
        "git branch",
        "npm install",
        "npm test",
        "npm run",
        "yarn install",
        "yarn test",
        "pip install",
        "pytest",
        "mvn test",
        "gradle test",
        "make",
        "cargo build",
        "cargo test",
        "go test",
        "go build"
      ],
      "disallowedCommands": [
        "rm -rf",
        "sudo",
        "chmod 777",
        "git push --force",
        "git reset --hard",
        "dd",
        "mkfs",
        "format"
      ],
      "executionTimeout": 300000
    },
    "edit": {
      "maxFileSize": 1000000
    },
    "create": {
      "maxFileSize": 1000000,
      "disallowedPaths": [
        "/.git/",
        "/etc/",
        "/usr/",
        "/bin/"
      ]
    }
  },
  "permissions": {
    "allow": [
      "Read(./src/**)",
      "Read(./tests/**)",
      "Read(./docs/**)",
      "Read(./README.md)",
      "Read(./package.json)",
      "Write(./src/**)",
      "Write(./tests/**)",
      "Write(./docs/**)",
      "Bash(npm *)",
      "Bash(yarn *)",
      "Bash(pip *)",
      "Bash(git status)",
      "Bash(git diff)",
      "Bash(git log *)",
      "Bash(git branch)"
    ],
    "deny": [
      "Read(**/.env*)",
      "Read(**/secrets/**)",
      "Read(**/.aws/**)",
      "Read(**/.ssh/**)",
      "Read(**/*.key)",
      "Read(**/*.pem)",
      "Write(**/node_modules/**)",
      "Write(**/dist/**)",
      "Write(**/build/**)",
      "Bash(rm -rf *)",
      "Bash(sudo *)",
      "Bash(git push --force)"
    ],
    "ask": [
      "Write(./package.json)",
      "Write(./package-lock.json)",
      "Write(./yarn.lock)",
      "Bash(git add *)",
      "Bash(git commit *)"
    ],
    "defaultMode": "ask"
  },
  "env": {
    "NODE_ENV": "development"
  },
  "llm": {
    "model": "claude-sonnet-4-20250514",
    "temperature": 0.3
  },
  "execution": {
    "timeout": 300
  },
  "limits": {
    "maxFileSize": 1000000,
    "maxResults": 100
  },
  "hooks": {
    "SessionStart": [
      {
        "type": "command",
        "command": "echo 'ğŸ“Š GitçŠ¶æ…‹' && git status --short",
        "matcher": "startup"
      }
    ]
  },
  "notes": [
    "ğŸ¯ ã“ã®è¨­å®šã¯æœ€é©åŒ–æ¸ˆã¿ã§ã€ãã®ã¾ã¾ä½¿ç”¨ã§ãã¾ã™",
    "æ—¢å­˜ã®standardè¨­å®šã«å®Ÿç”¨çš„ãªé«˜åº¦ã‚ªãƒ—ã‚·ãƒ§ãƒ³ã‚’çµ„ã¿è¾¼ã¿æ¸ˆã¿ï¼š",
    "  âœ“ permissions: ã‚»ã‚­ãƒ¥ã‚¢ãªæ¨©é™ç®¡ç†",
    "  âœ“ env: é–‹ç™ºç’°å¢ƒå¤‰æ•°",
    "  âœ“ llm: æœ€æ–°ãƒ¢ãƒ‡ãƒ«è¨­å®š",
    "  âœ“ hooks: è‡ªå‹•GitçŠ¶æ…‹è¡¨ç¤º",
    "  âœ“ execution/limits: ãƒªã‚½ãƒ¼ã‚¹åˆ¶é™",
    "ã»ã¨ã‚“ã©ã®é–‹ç™ºãƒ—ãƒ­ã‚¸ã‚§ã‚¯ãƒˆã«é©ã—ã¦ã„ã¾ã™",
    "ãƒ—ãƒ­ã‚¸ã‚§ã‚¯ãƒˆãƒ«ãƒ¼ãƒˆã® .claude/settings.json ã«ã‚³ãƒ”ãƒ¼ã—ã¦ä½¿ç”¨ã—ã¦ãã ã•ã„"
  ]
}
